Brand,Model,Price,Link
Scarpa,Climbing Shoes Scarpa Quantix SF W's Summer 2022,202.3,https://basecamp-shop.com/en/product/climbing-shoes-scarpa-quantix-sf-ws-s2022
Scarpa,Climbing Shoes Scarpa Origin W's Summer 2022,139.3,https://basecamp-shop.com/en/product/climbing-shoes-scarpa-origin-ws-s2022
Scarpa,Climbing Shoes Scarpa Vapor V W's Summer 2022,202.3,https://basecamp-shop.com/en/product/cimbing-shoes-scarpa-vapor-v-ws-s2022
Scarpa,Climbing Shoes Scarpa Drago Summer 2022,209.3,https://basecamp-shop.com/en/product/climbing-shoes-scarpa-drago-s2022
Scarpa,Climbing Shoes Scarpa Instinct VS W's Summer 2022,216.3,https://basecamp-shop.com/en/product/climbing-shoes-scarpa-instinct-vs-ws-s2022
Scarpa,Scarpa Instinct VS Climbing Shoes Summer 2022,216.3,https://basecamp-shop.com/en/product/scarpa-instinct-vs-s2022
Scarpa,Scarpa Mago Climbing Shoes Summer 2022,216.3,https://basecamp-shop.com/en/product/scarpa-mago-s2022
Scarpa,Climbing Shoes Scarpa Drago Kid Summer 2022,118.3,https://basecamp-shop.com/en/product/climbing-shoes-scarpa-drago-kid-s2022
Scarpa,Climbing Shoes Scarpa Quantix SF Summer 2022,202.3,https://basecamp-shop.com/en/product/climbing-shoes-scarpa-quantix-sf-s2022
Scarpa,Climbing Shoes Scarpa Instinct S Summer 2022,202.3,https://basecamp-shop.com/en/product/climbing-shoes-scarpa-instinct-s-s2022
Scarpa,Climbing Shoes Scarpa Velocity M's Summer 2022,146.3,https://basecamp-shop.com/en/product/climbing-shoes-scarpa-velocity-ms-s2022
Scarpa,Climbing Shoes Scarpa Boostic Summer 2022,230.3,https://basecamp-shop.com/en/product/climbing-shoes-scarpa-boostic-summer-2022
Scarpa,Climbing Shoes Scarpa Furia Air Summer 2022,223.3,https://basecamp-shop.com/en/product/climbing-shoes-scarpa-furia-air-summer-2022
Scarpa,Climbing Shoes Scarpa Furia S Summer 2022,216.3,https://basecamp-shop.com/en/product/climbing-shoes-scarpa-furia-s-summer-2022
Scarpa,Climbing Shoes Scarpa Velocity W's Summer 2022,146.3,https://basecamp-shop.com/en/product/climbing-shoes-scarpa-velocity-ws-summer-2022
Black Diamond USA,Black Diamond Momentum Climbing Shoes W's Summer 2022,125.3,https://basecamp-shop.com/en/product/black-diamond-momentum-climbing-shoes-ws-s2022
Black Diamond USA,Black Diamond Momentum Climbing Shoes M's Summer 2022,125.3,https://basecamp-shop.com/en/product/black-diamond-momentum-climbing-shoes-ms-s2022
Scarpa,Shoes Scarpa Spirit Evo W's Summer 2022,188.3,https://basecamp-shop.com/en/product/shoes-scarpa-spirit-evo-ws-s2022
Black Diamond USA,Black Diamond M's Circuit Approach Shoes Summer 2022,125.3,https://basecamp-shop.com/en/product/black-diamond-ms-circuit-approach-shoes-s2022
Black Diamond USA,Approach Shoes Black Diamond Prime M's Summer 2022,139.3,https://basecamp-shop.com/en/product/approach-shoes-black-diamond-prime-ms-s2022
Black Diamond USA,Approach Shoes Black Diamond Fuel M's Summer 2022,209.3,https://basecamp-shop.com/en/product/approach-shoes-black-diamond-fuel-ms-s2022
Scarpa,Shoes Scarpa Spirit W's Summer 2022,188.3,https://basecamp-shop.com/en/product/shoes-scarpa-spirit-ws-s2022
Scarpa,Shoes Scarpa Spirit Evo M's Summer 2022,188.3,https://basecamp-shop.com/en/product/shoes-scarpa-spirit-evo-ms-summer-2022
Scarpa,Climbing Shoes Scarpa Quantic W's Winter 2022,181.3,https://basecamp-shop.com/en/product/climbing-shoes-scarpa-quantic-ws-w2022
